name;tagline;description;category;minQuantity;maxQuantity;variant1_type;variant1_price;variant2_type;variant2_price;variant3_type;variant3_price
Marmer Buttercake;Kelembutan klasik penuh rasa;Buttercake marmer lembut dengan aroma butter yang khas, menghadirkan rasa manis yang sempurna.;Cake;1;10;22 x 22 (cm);100000;;;;
Bolu Tape Keju Bulat;Bolu tape lembut dengan keju melimpah;Bolu berbahan tape singkong yang lembut dipadukan dengan keju gurih, menghasilkan rasa unik yang nikmat.;Cake;1;10;20 cm;70000;;;;
Prol Tape;Manis dan gurih tape khas nusantara;Kue tape singkong dengan tekstur lembut dan rasa manis alami, sempurna untuk camilan istimewa.;Cake;1;10;20 x 10 (cm);40000;;;;
Macaroni Schotel;Klasik, lembut, dan kaya keju;Hidangan makaroni dengan saus creamy dan keju yang gurih, sempurna dinikmati hangat sebagai camilan.;Cake;1;10;Sedang 20 x 10 (cm);75000;Besar 20 x 20 (cm);160000;;
Beef Lasagna;Lasagna daging sapi lezat;Lasagna dengan lapisan daging sapi cincang, saus tomat segar, dan keju leleh, memberikan rasa Italia yang autentik.;Cake;1;10;Sedang 20 x 10 (cm);70000;Besar 20 x 20 (cm);170000;;
Lasagna Jamur;Pilihan lasagna vegetarian lezat;Lasagna vegetarian dengan lapisan jamur yang juicy dan saus creamy, alternatif sehat nan lezat.;Cake;1;10;Sedang 20 x 10 (cm);70000;;;;